{
  "schema": 2,
  "project": {
    "key": "landing-live",
    "title": "Progress page build",
    "subtitle": "How the Progress page itself is being built (work order #149). It tracks its own construction.",
    "updatedAt": "2026-10-22T01:51:44Z",
    "updatedBy": "OTM",
    "staleAfterMin": 120
  },
  "chats": {
    "coder": {
      "label": "Coder L1 g5",
      "id8": "6ad937de"
    }
  },
  "topics": [
    {
      "key": "prg-core",
      "label": "PRG-CORE-1",
      "order": 1,
      "title": "Portable Progress core (work order #149)",
      "updatedAt": "2026-10-22T01:26:02Z"
    }
  ]
}
